{
  "$schema": "../../schemas/effect.schema.json",
  "schema_version": 1,
  "id": "comet",
  "name": "Comet",
  "description": "A bright head chasing a desk loop",
  "needs": "",
  "layers": [
    {
      "primitive": "static",
      "palette": [
        { "pos": 0.0, "color": "#04060C" }
      ]
    },
    {
      "primitive": "comet",
      "path": [
        [-0.06, 0.05, 0.26],
        [0.26, 0.05, 0.27],
        [0.40, 0.10, 0.08],
        [0.47, 0.16, 0.05],
        [0.44, 0.34, -0.14],
        [0.47, 0.43, -0.10],
        [0.47, 0.30, -0.29],
        [0.20, 0.05, -0.05]
      ],
      "speed": { "remix": [0.35, 0.65] },
      "scale": { "remix": [0.25, 0.45] },
      "phase": { "remix01": true },
      "opacity": 1.0,
      "palette": [
        { "pos": 0.0, "color": "#FFFFFF" },
        { "pos": 0.25, "color": "#40C8FF" },
        { "pos": 0.7, "color": "#103060" },
        { "pos": 1.0, "color": "#000810" }
      ]
    }
  ]
}
