{
  "$schema": "../../schemas/effect.schema.json",
  "schema_version": 1,
  "id": "embers",
  "name": "Embers",
  "description": "Warm noise with rising sparks",
  "needs": "",
  "layers": [
    {
      "primitive": "noise",
      "scale": { "remix": [3.0, 5.0] },
      "direction": [0.05, 0.30, 0.02],
      "speed": { "remix": [0.5, 0.9] },
      "density": { "remix": [0.35, 0.55] },
      "seed": { "remix_u32": [0, 4294967295] },
      "opacity": 0.95,
      "palette": [
        { "pos": 0.0, "color": "#200400" },
        { "pos": 0.45, "color": "#8C2000" },
        { "pos": 0.75, "color": "#FF6010" },
        { "pos": 0.95, "color": "#FFB030" }
      ]
    },
    {
      "primitive": "noise",
      "blend": "screen",
      "scale": 9.0,
      "direction": [0.02, 0.60, 0.05],
      "speed": { "remix": [0.8, 1.4] },
      "density": { "remix": [0.88, 0.94] },
      "seed": { "remix_u32": [0, 4294967295] },
      "opacity": 0.85,
      "palette": [
        { "pos": 0.0, "color": "#FFD040" },
        { "pos": 0.6, "color": "#FFF0A0" }
      ]
    }
  ]
}
